{
  "schema": "advogadoja.tela.modular.v4-proposta",
  "identidade": {
    "id": "estudante.perfil.editar_academicos",
    "nome": "Edição de dados acadêmicos",
    "tipo": "tela",
    "versao": "1.0.0",
    "rota": "/estudante/perfil/editar_academicos",
    "status": "pendente_definicao_visual"
  },
  "classificacao": {
    "escopo": "estudante",
    "jornadas": [
      "estudante"
    ],
    "subjornadas": [
      "perfil"
    ],
    "compartilhada": false,
    "localizacaoArvore": {
      "secao": "Telas",
      "segmentos": [
        "estudante",
        "perfil"
      ],
      "chave": "editar_academicos",
      "ordem": 34
    }
  },
  "estados": {
    "fonte": "contexto.estado",
    "fallbackSeguro": "padrao",
    "grupos": [
      {
        "id": "padrao",
        "nome": "Padrão"
      }
    ]
  },
  "componentes": {
    "instancias": [
      {
        "id": "conteudo_principal",
        "ref": "cmp.estudante.perfil.editar_academicos.modelo.v01",
        "slot": "main",
        "ordem": 10,
        "props": {},
        "aplicaA": {
          "jornadas": [
            "*"
          ],
          "estados": [
            "*"
          ]
        }
      }
    ]
  },
  "estrutura": {
    "base": {
      "id": "base_estudante.perfil.editar_academicos",
      "html": "<div class=\"prototype-screen\" data-screen-id=\"estudante.perfil.editar_academicos\"><main data-slot=\"main\"></main></div>",
      "raiz": "prototype-screen",
      "layout": {
        "slots": [
          "main"
        ]
      },
      "aplicaA": {
        "jornadas": [
          "*"
        ],
        "estados": [
          "*"
        ]
      }
    },
    "grupos": [
      {
        "id": "conteudo_principal",
        "slot": "main",
        "ordem": 10,
        "instancias": [
          "conteudo_principal"
        ],
        "aplicaA": {
          "jornadas": [
            "*"
          ],
          "estados": [
            "*"
          ]
        }
      }
    ]
  },
  "estilos": {
    "tema": {},
    "grupos": []
  },
  "acoes": {
    "grupos": []
  },
  "dados": {
    "grupos": {},
    "fontes": [],
    "persistencia": {
      "entidades": [],
      "relacoes": []
    }
  },
  "mocks": {
    "grupos": {},
    "cenarios": {
      "padrao": {
        "id": "padrao"
      }
    }
  },
  "flow": {
    "editor": {
      "entrypoint": false,
      "rootSequenceId": null,
      "occurrences": [
        {
          "id": "screen-modelo-estudante-student_academic_edit",
          "sequenceId": "sequence-modelo-estudante",
          "order": 17,
          "variant": "padrao"
        }
      ],
      "branches": []
    }
  }
}
