{
  "schema": "advogadoja.tela.modular.v4-proposta",
  "identidade": {
    "id": "estudante.configuracao.meus_chamados",
    "nome": "Meus chamados",
    "tipo": "tela",
    "versao": "1.0.0",
    "rota": "/estudante/configuracao/meus_chamados",
    "status": "pendente_definicao_visual"
  },
  "classificacao": {
    "escopo": "estudante",
    "jornadas": [
      "estudante"
    ],
    "subjornadas": [
      "configuracao"
    ],
    "compartilhada": false,
    "localizacaoArvore": {
      "secao": "Telas",
      "segmentos": [
        "estudante",
        "configuracao"
      ],
      "chave": "meus_chamados",
      "ordem": 44
    }
  },
  "estados": {
    "fonte": "contexto.estado",
    "fallbackSeguro": "padrao",
    "grupos": [
      {
        "id": "padrao",
        "nome": "Padrão"
      }
    ]
  },
  "componentes": {
    "instancias": [
      {
        "id": "conteudo_principal",
        "ref": "cmp.estudante.configuracao.meus_chamados.modelo.v01",
        "slot": "main",
        "ordem": 10,
        "props": {},
        "aplicaA": {
          "jornadas": [
            "*"
          ],
          "estados": [
            "*"
          ]
        }
      }
    ]
  },
  "estrutura": {
    "base": {
      "id": "base_estudante.configuracao.meus_chamados",
      "html": "<div class=\"prototype-screen\" data-screen-id=\"estudante.configuracao.meus_chamados\"><main data-slot=\"main\"></main></div>",
      "raiz": "prototype-screen",
      "layout": {
        "slots": [
          "main"
        ]
      },
      "aplicaA": {
        "jornadas": [
          "*"
        ],
        "estados": [
          "*"
        ]
      }
    },
    "grupos": [
      {
        "id": "conteudo_principal",
        "slot": "main",
        "ordem": 10,
        "instancias": [
          "conteudo_principal"
        ],
        "aplicaA": {
          "jornadas": [
            "*"
          ],
          "estados": [
            "*"
          ]
        }
      }
    ]
  },
  "estilos": {
    "tema": {},
    "grupos": []
  },
  "acoes": {
    "grupos": []
  },
  "dados": {
    "grupos": {},
    "fontes": [],
    "persistencia": {
      "entidades": [],
      "relacoes": []
    }
  },
  "mocks": {
    "grupos": {},
    "cenarios": {
      "padrao": {
        "id": "padrao"
      }
    }
  },
  "flow": {
    "editor": {
      "entrypoint": false,
      "rootSequenceId": null,
      "occurrences": [
        {
          "id": "screen-modelo-estudante-student_tickets",
          "sequenceId": "sequence-modelo-estudante",
          "order": 26,
          "variant": "padrao"
        }
      ],
      "branches": []
    }
  }
}
