{
  "schema": "advogadoja.tela.modular.v4-proposta",
  "identidade": {
    "id": "admin.logs",
    "nome": "Logs e auditoria",
    "tipo": "tela",
    "versao": "3.0.0",
    "rota": "/admin/logs",
    "status": "rascunho-evolutivo"
  },
  "classificacao": {
    "escopo": "administrador",
    "jornadas": [
      "administrador"
    ],
    "subjornadas": [
      "logs"
    ],
    "compartilhada": false,
    "localizacaoArvore": {
      "secao": "Telas",
      "segmentos": [
        "admin"
      ],
      "chave": "logs",
      "ordem": 25
    }
  },
  "estados": {
    "fonte": "contexto.estado",
    "fallbackSeguro": "padrao",
    "grupos": [
      {
        "id": "padrao",
        "nome": "Padrão"
      }
    ]
  },
  "componentes": {
    "instancias": [
      {
        "id": "estilos_base_administrador",
        "ref": "style.jornadas.modular.administrador.v01",
        "slot": "styles",
        "ordem": 0,
        "props": {},
        "aplicaA": {
          "jornadas": [
            "administrador"
          ],
          "estados": [
            "*"
          ]
        }
      },
      {
        "id": "conteudo_administrador",
        "ref": "cmp.admin.logs.perfil_administrador.v01",
        "slot": "main",
        "ordem": 10,
        "props": {},
        "aplicaA": {
          "jornadas": [
            "administrador"
          ],
          "estados": [
            "*"
          ]
        }
      }
    ]
  },
  "estrutura": {
    "base": {
      "id": "html_base_admin_logs",
      "html": "<div class=\"prototype-screen\" data-screen-id=\"admin.logs\"><div data-slot=\"styles\"></div><main data-slot=\"main\"></main></div>",
      "raiz": "prototype-screen",
      "layout": {
        "larguraConteudo": "100%",
        "slots": [
          "styles",
          "main"
        ],
        "resolucao": "cada grupo de estrutura insere instâncias no slot data-slot correspondente"
      },
      "aplicaA": {
        "jornadas": [
          "administrador"
        ],
        "estados": [
          "*"
        ]
      }
    },
    "grupos": [
      {
        "id": "estilos_administrador",
        "slot": "styles",
        "ordem": 0,
        "instancias": [
          "estilos_base_administrador"
        ],
        "aplicaA": {
          "jornadas": [
            "administrador"
          ],
          "estados": [
            "*"
          ]
        }
      },
      {
        "id": "conteudo_administrador",
        "slot": "main",
        "ordem": 10,
        "instancias": [
          "conteudo_administrador"
        ],
        "aplicaA": {
          "jornadas": [
            "administrador"
          ],
          "estados": [
            "*"
          ]
        }
      }
    ]
  },
  "estilos": {
    "tema": {},
    "grupos": []
  },
  "acoes": {
    "grupos": [
      {
        "id": "navegacao_administrador_logs",
        "origem": "jornada_modelo",
        "aplicaA": {
          "jornadas": [
            "administrador"
          ],
          "estados": [
            "*"
          ]
        },
        "acoes": [
          {
            "id": "logs_continua_admin.log_detalhe",
            "tipo": "navegacao_declarada",
            "evento": "continua",
            "rotulo": "Continuar",
            "destino": "admin.log_detalhe",
            "contextoJornada": "administrador",
            "origemNo": "logs",
            "caminho": "continua",
            "estadosIntermediarios": [],
            "detalhe": ""
          }
        ]
      }
    ]
  },
  "dados": {
    "grupos": {},
    "fontes": [],
    "persistencia": {
      "entidades": [
        {
          "id": "audit_logs",
          "nome": "Logs / auditoria",
          "dominio": "admin",
          "campos": [
            {
              "id": "id",
              "tipo": "uuid · PK",
              "acesso": "a_confirmar"
            },
            {
              "id": "actor_user_id",
              "tipo": "uuid · FK?",
              "acesso": "a_confirmar"
            },
            {
              "id": "event_key",
              "tipo": "varchar",
              "acesso": "a_confirmar"
            },
            {
              "id": "entity_type",
              "tipo": "varchar",
              "acesso": "a_confirmar"
            },
            {
              "id": "entity_id",
              "tipo": "uuid?",
              "acesso": "a_confirmar"
            },
            {
              "id": "metadata_json",
              "tipo": "jsonb?",
              "acesso": "a_confirmar"
            },
            {
              "id": "created_at",
              "tipo": "timestamptz",
              "acesso": "a_confirmar"
            }
          ]
        }
      ],
      "relacoes": [
        {
          "id": "rel-users-actor_user_id-audit_logs",
          "origem": {
            "entidade": "users"
          },
          "destino": {
            "entidade": "audit_logs"
          },
          "campoReferencia": "actor_user_id",
          "cardinalidade": "1:N"
        }
      ],
      "contrato": "declarações canônicas da tela; Banco é projeção agregada destas declarações"
    }
  },
  "mocks": {
    "grupos": {},
    "cenarios": {
      "padrao": {
        "id": "padrao"
      }
    }
  },
  "flow": {
    "editor": {
      "entrypoint": false,
      "rootSequenceId": null,
      "occurrences": [
        {
          "id": "screen-modelo-administrador-logs",
          "sequenceId": "sequence-modelo-administrador",
          "order": 10,
          "variant": "padrao"
        }
      ],
      "branches": []
    }
  }
}
