{
  "schema": "advogadoja.tela.modular.v4-proposta",
  "identidade": {
    "id": "advogado.configuracao.consentimentos",
    "nome": "Consentimentos",
    "tipo": "tela",
    "versao": "3.0.0",
    "rota": "/professional/settings/legal/consents",
    "status": "rascunho-evolutivo"
  },
  "classificacao": {
    "escopo": "advogado",
    "jornadas": [
      "advogado"
    ],
    "subjornadas": [
      "configuracao"
    ],
    "compartilhada": false,
    "localizacaoArvore": {
      "secao": "Telas",
      "segmentos": [
        "advogado",
        "configuracao"
      ],
      "chave": "consentimentos",
      "ordem": 50
    }
  },
  "estados": {
    "fonte": "contexto.estado",
    "fallbackSeguro": "padrao",
    "grupos": [
      {
        "id": "padrao",
        "nome": "Padrão"
      }
    ]
  },
  "componentes": {
    "instancias": [
      {
        "id": "estilos_base_advogado",
        "ref": "style.jornadas.modular.advogado.v01",
        "slot": "styles",
        "ordem": 0,
        "props": {},
        "aplicaA": {
          "jornadas": [
            "advogado"
          ],
          "estados": [
            "*"
          ]
        }
      },
      {
        "id": "conteudo_advogado",
        "ref": "cmp.advogado.configuracao.consentimentos.perfil_advogado.v01",
        "slot": "main",
        "ordem": 10,
        "props": {},
        "aplicaA": {
          "jornadas": [
            "advogado"
          ],
          "estados": [
            "*"
          ]
        }
      }
    ]
  },
  "estrutura": {
    "base": {
      "id": "html_base_advogado_configuracao_consentimentos",
      "html": "<div class=\"prototype-screen\" data-screen-id=\"advogado.configuracao.consentimentos\"><div data-slot=\"styles\"></div><main data-slot=\"main\"></main></div>",
      "raiz": "prototype-screen",
      "layout": {
        "larguraConteudo": "100%",
        "slots": [
          "styles",
          "main"
        ],
        "resolucao": "cada grupo de estrutura insere instâncias no slot data-slot correspondente"
      },
      "aplicaA": {
        "jornadas": [
          "administrador",
          "advogado",
          "estudante"
        ],
        "estados": [
          "*"
        ]
      }
    },
    "grupos": [
      {
        "id": "estilos_advogado",
        "slot": "styles",
        "ordem": 0,
        "instancias": [
          "estilos_base_advogado"
        ],
        "aplicaA": {
          "jornadas": [
            "advogado"
          ],
          "estados": [
            "*"
          ]
        }
      },
      {
        "id": "conteudo_advogado",
        "slot": "main",
        "ordem": 10,
        "instancias": [
          "conteudo_advogado"
        ],
        "aplicaA": {
          "jornadas": [
            "advogado"
          ],
          "estados": [
            "*"
          ]
        }
      }
    ]
  },
  "estilos": {
    "tema": {},
    "grupos": []
  },
  "acoes": {
    "grupos": []
  },
  "dados": {
    "grupos": {},
    "fontes": [],
    "persistencia": {
      "entidades": [
        {
          "id": "user_consents",
          "nome": "Consentimentos",
          "dominio": "core",
          "campos": [
            {
              "id": "id",
              "tipo": "uuid · PK",
              "acesso": "a_confirmar"
            },
            {
              "id": "user_id",
              "tipo": "uuid · FK",
              "acesso": "a_confirmar"
            },
            {
              "id": "legal_document_id",
              "tipo": "uuid · FK?",
              "acesso": "a_confirmar"
            },
            {
              "id": "consent_key",
              "tipo": "varchar",
              "acesso": "a_confirmar"
            },
            {
              "id": "granted",
              "tipo": "boolean",
              "acesso": "a_confirmar"
            },
            {
              "id": "recorded_at",
              "tipo": "timestamptz",
              "acesso": "a_confirmar"
            }
          ]
        },
        {
          "id": "legal_documents",
          "nome": "Documentos legais",
          "dominio": "core",
          "campos": [
            {
              "id": "id",
              "tipo": "uuid · PK",
              "acesso": "a_confirmar"
            },
            {
              "id": "document_type",
              "tipo": "terms|privacy",
              "acesso": "a_confirmar"
            },
            {
              "id": "version",
              "tipo": "varchar",
              "acesso": "a_confirmar"
            },
            {
              "id": "content_url",
              "tipo": "text",
              "acesso": "a_confirmar"
            },
            {
              "id": "published_at",
              "tipo": "timestamptz",
              "acesso": "a_confirmar"
            },
            {
              "id": "active",
              "tipo": "boolean",
              "acesso": "a_confirmar"
            }
          ]
        }
      ],
      "relacoes": [
        {
          "id": "rel-users-user_id-user_consents",
          "origem": {
            "entidade": "users"
          },
          "destino": {
            "entidade": "user_consents"
          },
          "campoReferencia": "user_id",
          "cardinalidade": "1:N"
        },
        {
          "id": "rel-legal_documents-legal_document_id-user_consents",
          "origem": {
            "entidade": "legal_documents"
          },
          "destino": {
            "entidade": "user_consents"
          },
          "campoReferencia": "legal_document_id",
          "cardinalidade": "1:N"
        }
      ],
      "contrato": "declarações canônicas da tela; Banco é projeção agregada destas declarações"
    }
  },
  "mocks": {
    "grupos": {},
    "cenarios": {
      "padrao": {
        "id": "padrao"
      }
    }
  },
  "flow": {
    "editor": {
      "entrypoint": false,
      "rootSequenceId": null,
      "occurrences": [
        {
          "id": "screen-modelo-advogado-consents",
          "sequenceId": "sequence-modelo-advogado",
          "order": 39,
          "variant": "padrao"
        }
      ],
      "branches": []
    }
  }
}
