{
  "schema": "advogadoja.tela.modular.v4-proposta",
  "identidade": {
    "id": "advogado.validacao_profissional",
    "nome": "Onboarding Advogado · Validação profissional",
    "tipo": "tela",
    "versao": "3.0.0",
    "rota": "/onboarding/advogado/validacao",
    "status": "rascunho-evolutivo"
  },
  "classificacao": {
    "escopo": "advogado",
    "jornadas": [
      "advogado",
      "administrador",
      "estudante"
    ],
    "subjornadas": [
      "onboarding"
    ],
    "compartilhada": true,
    "localizacaoArvore": {
      "secao": "Telas",
      "segmentos": [
        "advogado",
        "onboarding"
      ],
      "chave": "validacao_profissional",
      "ordem": 8
    }
  },
  "estados": {
    "fonte": "contexto.estado",
    "fallbackSeguro": "padrao",
    "grupos": [
      {
        "id": "padrao",
        "nome": "Padrão"
      }
    ]
  },
  "componentes": {
    "instancias": [
      {
        "id": "estilos_base_administrador",
        "ref": "style.jornadas.projeto1.administrador.v01",
        "slot": "styles",
        "ordem": 0,
        "props": {},
        "aplicaA": {
          "jornadas": [
            "administrador"
          ],
          "estados": [
            "*"
          ]
        }
      },
      {
        "id": "conteudo_administrador",
        "ref": "cmp.advogado.validacao_profissional.j1_administrador.v01",
        "slot": "main",
        "ordem": 10,
        "props": {},
        "aplicaA": {
          "jornadas": [
            "administrador"
          ],
          "estados": [
            "*"
          ]
        }
      },
      {
        "id": "estilos_base_advogado",
        "ref": "style.jornadas.projeto1.advogado.v01",
        "slot": "styles",
        "ordem": 0,
        "props": {},
        "aplicaA": {
          "jornadas": [
            "advogado"
          ],
          "estados": [
            "*"
          ]
        }
      },
      {
        "id": "conteudo_advogado",
        "ref": "cmp.advogado.validacao_profissional.j1_advogado.v01",
        "slot": "main",
        "ordem": 10,
        "props": {},
        "aplicaA": {
          "jornadas": [
            "advogado"
          ],
          "estados": [
            "*"
          ]
        }
      },
      {
        "id": "estilos_base_estudante",
        "ref": "style.jornadas.projeto1.estudante.v01",
        "slot": "styles",
        "ordem": 0,
        "props": {},
        "aplicaA": {
          "jornadas": [
            "estudante"
          ],
          "estados": [
            "*"
          ]
        }
      },
      {
        "id": "conteudo_estudante",
        "ref": "cmp.advogado.validacao_profissional.j1_estudante.v01",
        "slot": "main",
        "ordem": 10,
        "props": {},
        "aplicaA": {
          "jornadas": [
            "estudante"
          ],
          "estados": [
            "*"
          ]
        }
      }
    ]
  },
  "estrutura": {
    "base": {
      "id": "html_base_advogado_validacao_profissional",
      "html": "<div class=\"prototype-screen\" data-screen-id=\"advogado.validacao_profissional\"><div data-slot=\"styles\"></div><main data-slot=\"main\"></main></div>",
      "raiz": "prototype-screen",
      "layout": {
        "larguraConteudo": "100%",
        "slots": [
          "styles",
          "main"
        ],
        "resolucao": "cada grupo de estrutura insere instâncias no slot data-slot correspondente"
      },
      "aplicaA": {
        "jornadas": [
          "administrador",
          "advogado",
          "estudante"
        ],
        "estados": [
          "*"
        ]
      }
    },
    "grupos": [
      {
        "id": "estilos_administrador",
        "slot": "styles",
        "ordem": 0,
        "instancias": [
          "estilos_base_administrador"
        ],
        "aplicaA": {
          "jornadas": [
            "administrador"
          ],
          "estados": [
            "*"
          ]
        }
      },
      {
        "id": "conteudo_administrador",
        "slot": "main",
        "ordem": 10,
        "instancias": [
          "conteudo_administrador"
        ],
        "aplicaA": {
          "jornadas": [
            "administrador"
          ],
          "estados": [
            "*"
          ]
        }
      },
      {
        "id": "estilos_advogado",
        "slot": "styles",
        "ordem": 0,
        "instancias": [
          "estilos_base_advogado"
        ],
        "aplicaA": {
          "jornadas": [
            "advogado"
          ],
          "estados": [
            "*"
          ]
        }
      },
      {
        "id": "conteudo_advogado",
        "slot": "main",
        "ordem": 10,
        "instancias": [
          "conteudo_advogado"
        ],
        "aplicaA": {
          "jornadas": [
            "advogado"
          ],
          "estados": [
            "*"
          ]
        }
      },
      {
        "id": "estilos_estudante",
        "slot": "styles",
        "ordem": 0,
        "instancias": [
          "estilos_base_estudante"
        ],
        "aplicaA": {
          "jornadas": [
            "estudante"
          ],
          "estados": [
            "*"
          ]
        }
      },
      {
        "id": "conteudo_estudante",
        "slot": "main",
        "ordem": 10,
        "instancias": [
          "conteudo_estudante"
        ],
        "aplicaA": {
          "jornadas": [
            "estudante"
          ],
          "estados": [
            "*"
          ]
        }
      }
    ]
  },
  "estilos": {
    "tema": {},
    "grupos": []
  },
  "acoes": {
    "grupos": [
      {
        "id": "navegacao_importada_flow_v3",
        "origem": "flow_v3",
        "aplicaA": {
          "jornadas": [
            "*"
          ],
          "estados": [
            "*"
          ]
        },
        "acoes": [
          {
            "id": "rel-advogado.validacao_profissional-navigate-s020-advogado.onboarding.revisao_profissional-1",
            "tipo": "ligacao_flow_migrada",
            "destino": "advogado.onboarding.revisao_profissional",
            "evento": "legacy-event",
            "rotulo": "Elemento com destino advogado.onboarding.revisao_profissional",
            "prioridade": 1000,
            "portasLegadas": {
              "saida": "out-navigate-s020-advogado.onboarding.revisao_profissional-1",
              "entrada": "in-advogado.validacao_profissional-navigate-s020-1"
            }
          },
          {
            "id": "rel-advogado.validacao_profissional-navigate-s022-advogado.home_advogado-2",
            "tipo": "ligacao_flow_migrada",
            "destino": "advogado.home_advogado",
            "evento": "legacy-event",
            "rotulo": "Elemento com destino advogado.home_advogado",
            "prioridade": 999,
            "portasLegadas": {
              "saida": "out-navigate-s022-advogado.home_advogado-2",
              "entrada": "in-advogado.validacao_profissional-navigate-s022-17"
            }
          }
        ]
      },
      {
        "id": "navegacao_jornadas_projeto1",
        "origem": "Projeto_1/jornadas",
        "aplicaA": {
          "jornadas": [
            "administrador",
            "advogado",
            "estudante"
          ],
          "estados": [
            "*"
          ]
        },
        "acoes": []
      }
    ]
  },
  "dados": {
    "grupos": {},
    "fontes": [],
    "persistencia": {
      "entidades": [],
      "relacoes": [],
      "contrato": "declarações de dados exigidas pela tela; Banco é projeção agregada destas declarações"
    }
  },
  "mocks": {
    "grupos": {},
    "cenarios": {
      "padrao": {
        "id": "padrao"
      }
    }
  },
  "flow": {
    "editor": {
      "entrypoint": false,
      "rootSequenceId": null,
      "occurrences": [
        {
          "id": "screen-0191",
          "sequenceId": "sequence-0270",
          "order": 9,
          "variant": "default"
        },
        {
          "id": "screen-0363",
          "sequenceId": "sequence-0421",
          "order": 16,
          "variant": "default"
        }
      ],
      "branches": []
    }
  }
}
