{
  "schema": "advogadoja.tela.modular.v4-proposta",
  "identidade": {
    "id": "advogado.configuracao.central_ajuda",
    "nome": "Central de ajuda",
    "tipo": "tela",
    "versao": "3.0.0",
    "rota": "/professional/settings/support/help",
    "status": "rascunho-evolutivo"
  },
  "classificacao": {
    "escopo": "advogado",
    "jornadas": [
      "advogado",
      "administrador",
      "estudante"
    ],
    "subjornadas": [
      "configuracao"
    ],
    "compartilhada": true,
    "localizacaoArvore": {
      "secao": "Telas",
      "segmentos": [
        "advogado",
        "configuracao"
      ],
      "chave": "central_ajuda",
      "ordem": 31
    }
  },
  "estados": {
    "fonte": "contexto.estado",
    "fallbackSeguro": "padrao",
    "grupos": [
      {
        "id": "padrao",
        "nome": "Padrão"
      }
    ]
  },
  "componentes": {
    "instancias": [
      {
        "id": "estilos_base_administrador",
        "ref": "style.jornadas.projeto1.administrador.v01",
        "slot": "styles",
        "ordem": 0,
        "props": {},
        "aplicaA": {
          "jornadas": [
            "administrador"
          ],
          "estados": [
            "*"
          ]
        }
      },
      {
        "id": "conteudo_administrador",
        "ref": "cmp.advogado.configuracao.central_ajuda.j1_administrador.v01",
        "slot": "main",
        "ordem": 10,
        "props": {},
        "aplicaA": {
          "jornadas": [
            "administrador"
          ],
          "estados": [
            "*"
          ]
        }
      },
      {
        "id": "estilos_base_advogado",
        "ref": "style.jornadas.projeto1.advogado.v01",
        "slot": "styles",
        "ordem": 0,
        "props": {},
        "aplicaA": {
          "jornadas": [
            "advogado"
          ],
          "estados": [
            "*"
          ]
        }
      },
      {
        "id": "conteudo_advogado",
        "ref": "cmp.advogado.configuracao.central_ajuda.j1_advogado.v01",
        "slot": "main",
        "ordem": 10,
        "props": {},
        "aplicaA": {
          "jornadas": [
            "advogado"
          ],
          "estados": [
            "*"
          ]
        }
      },
      {
        "id": "estilos_base_estudante",
        "ref": "style.jornadas.projeto1.estudante.v01",
        "slot": "styles",
        "ordem": 0,
        "props": {},
        "aplicaA": {
          "jornadas": [
            "estudante"
          ],
          "estados": [
            "*"
          ]
        }
      },
      {
        "id": "conteudo_estudante",
        "ref": "cmp.advogado.configuracao.central_ajuda.j1_estudante.v01",
        "slot": "main",
        "ordem": 10,
        "props": {},
        "aplicaA": {
          "jornadas": [
            "estudante"
          ],
          "estados": [
            "*"
          ]
        }
      }
    ],
    "contratoInstanciacao": {
      "resolver": "ref por ID no catalogo",
      "props": "props literais ou referências resolvidas pelo motor; componentes não carregam arquivos diretamente",
      "filtragem": "aplicaA de grupo e instância por jornada e estado",
      "semCopiaHTMLCSSNaTela": true,
      "montagem": "CSS da tela + CSS dos componentes selecionados; HTML base + árvores dos componentes selecionados"
    }
  },
  "estrutura": {
    "base": {
      "id": "html_base_advogado_configuracao_central_ajuda",
      "html": "<div class=\"prototype-screen\" data-screen-id=\"advogado.configuracao.central_ajuda\"><div data-slot=\"styles\"></div><main data-slot=\"main\"></main></div>",
      "raiz": "prototype-screen",
      "layout": {
        "larguraConteudo": "100%",
        "slots": [
          "styles",
          "main"
        ],
        "resolucao": "cada grupo de estrutura insere instâncias no slot data-slot correspondente"
      },
      "aplicaA": {
        "jornadas": [
          "administrador",
          "advogado",
          "estudante"
        ],
        "estados": [
          "*"
        ]
      }
    },
    "grupos": [
      {
        "id": "estilos_administrador",
        "slot": "styles",
        "ordem": 0,
        "instancias": [
          "estilos_base_administrador"
        ],
        "aplicaA": {
          "jornadas": [
            "administrador"
          ],
          "estados": [
            "*"
          ]
        }
      },
      {
        "id": "conteudo_administrador",
        "slot": "main",
        "ordem": 10,
        "instancias": [
          "conteudo_administrador"
        ],
        "aplicaA": {
          "jornadas": [
            "administrador"
          ],
          "estados": [
            "*"
          ]
        }
      },
      {
        "id": "estilos_advogado",
        "slot": "styles",
        "ordem": 0,
        "instancias": [
          "estilos_base_advogado"
        ],
        "aplicaA": {
          "jornadas": [
            "advogado"
          ],
          "estados": [
            "*"
          ]
        }
      },
      {
        "id": "conteudo_advogado",
        "slot": "main",
        "ordem": 10,
        "instancias": [
          "conteudo_advogado"
        ],
        "aplicaA": {
          "jornadas": [
            "advogado"
          ],
          "estados": [
            "*"
          ]
        }
      },
      {
        "id": "estilos_estudante",
        "slot": "styles",
        "ordem": 0,
        "instancias": [
          "estilos_base_estudante"
        ],
        "aplicaA": {
          "jornadas": [
            "estudante"
          ],
          "estados": [
            "*"
          ]
        }
      },
      {
        "id": "conteudo_estudante",
        "slot": "main",
        "ordem": 10,
        "instancias": [
          "conteudo_estudante"
        ],
        "aplicaA": {
          "jornadas": [
            "estudante"
          ],
          "estados": [
            "*"
          ]
        }
      }
    ]
  },
  "estilos": {
    "tema": {},
    "grupos": []
  },
  "acoes": {
    "grupos": [
      {
        "id": "navegacao_importada_flow_v3",
        "origem": "flow_v3",
        "aplicaA": {
          "jornadas": [
            "*"
          ],
          "estados": [
            "*"
          ]
        },
        "acoes": [
          {
            "id": "rel-advogado.configuracao.central_ajuda-out-1-advogado.configuracao.suporte-1",
            "tipo": "ligacao_flow_migrada",
            "destino": "advogado.configuracao.suporte",
            "evento": "legacy-event",
            "rotulo": "Suporte",
            "prioridade": 1000,
            "portasLegadas": {
              "saida": "out-out-1-advogado.configuracao.suporte-1",
              "entrada": "in-advogado.configuracao.central_ajuda-out-1-9"
            }
          }
        ]
      },
      {
        "id": "navegacao_jornadas_projeto1",
        "origem": "Projeto_1/jornadas",
        "aplicaA": {
          "jornadas": [
            "administrador",
            "advogado",
            "estudante"
          ],
          "estados": [
            "*"
          ]
        },
        "acoes": []
      }
    ]
  },
  "dados": {
    "grupos": {},
    "fontes": [],
    "persistencia": {
      "entidades": [],
      "relacoes": [],
      "contrato": "declarações canônicas da tela; Banco é projeção agregada destas declarações",
      "origemImportacao": {
        "artefato": "Projeto_1/modelos/modelagem_banco_todas_telas.html",
        "screenKeyFonte": "advogado.configuracao.central_ajuda",
        "statusCampos": "campos da entidade importados; operações por tela a confirmar nas jornadas"
      }
    }
  },
  "mocks": {
    "grupos": {},
    "cenarios": {
      "padrao": {
        "id": "padrao"
      }
    }
  },
  "flow": {
    "editor": {
      "entrypoint": false,
      "rootSequenceId": null,
      "occurrences": [
        {
          "id": "screen-5eb87c70-888a-4500-897f-ef2e9eb5501d",
          "sequenceId": "seq-32d355fd-7c8c-4661-b652-16f460a87fc1",
          "order": 0,
          "variant": "default"
        },
        {
          "id": "screen-home-onboarding-menu-suporte-central-ajuda",
          "sequenceId": "sequence-profissional-onboarding-menu-config",
          "order": 6,
          "variant": "default"
        },
        {
          "id": "screen-home-cadastro-menu-suporte-central-ajuda",
          "sequenceId": "sequence-profissional-cadastro-menu-config",
          "order": 6,
          "variant": "default"
        }
      ],
      "branches": []
    }
  }
}
