{
  "schema": "advogadoja.tela.modular.v4-proposta",
  "identidade": {
    "id": "admin.oab_detalhe",
    "nome": "Análise da OAB",
    "tipo": "tela",
    "versao": "1.0.0",
    "rota": "/admin/oab_detalhe",
    "status": "pendente_definicao_visual"
  },
  "classificacao": {
    "escopo": "administrador",
    "jornadas": [
      "administrador"
    ],
    "subjornadas": [
      "oab_detalhe"
    ],
    "compartilhada": false,
    "localizacaoArvore": {
      "secao": "Telas",
      "segmentos": [
        "admin"
      ],
      "chave": "oab_detalhe",
      "ordem": 14
    }
  },
  "estados": {
    "fonte": "contexto.estado",
    "fallbackSeguro": "padrao",
    "grupos": [
      {
        "id": "padrao",
        "nome": "Padrão"
      },
      {
        "id": "administrador_oab_decision_pending",
        "nome": "Critério/resultado de OAB a definir",
        "jornada": "administrador",
        "origemNo": "oab_decision_pending"
      },
      {
        "id": "administrador_oab_back_state",
        "nome": "Retorno à fila de OAB",
        "jornada": "administrador",
        "origemNo": "oab_back_state"
      }
    ]
  },
  "componentes": {
    "instancias": [
      {
        "id": "conteudo_principal",
        "ref": "cmp.admin.oab_detalhe.modelo.v01",
        "slot": "main",
        "ordem": 10,
        "props": {},
        "aplicaA": {
          "jornadas": [
            "*"
          ],
          "estados": [
            "*"
          ]
        }
      }
    ]
  },
  "estrutura": {
    "base": {
      "id": "base_admin.oab_detalhe",
      "html": "<div class=\"prototype-screen\" data-screen-id=\"admin.oab_detalhe\"><main data-slot=\"main\"></main></div>",
      "raiz": "prototype-screen",
      "layout": {
        "slots": [
          "main"
        ]
      },
      "aplicaA": {
        "jornadas": [
          "*"
        ],
        "estados": [
          "*"
        ]
      }
    },
    "grupos": [
      {
        "id": "conteudo_principal",
        "slot": "main",
        "ordem": 10,
        "instancias": [
          "conteudo_principal"
        ],
        "aplicaA": {
          "jornadas": [
            "*"
          ],
          "estados": [
            "*"
          ]
        }
      }
    ]
  },
  "estilos": {
    "tema": {},
    "grupos": []
  },
  "acoes": {
    "grupos": [
      {
        "id": "navegacao_administrador_oab_detail",
        "origem": "jornada_modelo",
        "aplicaA": {
          "jornadas": [
            "administrador"
          ],
          "estados": [
            "*"
          ]
        },
        "acoes": [
          {
            "id": "oab_detail_record_termino",
            "tipo": "estado_final",
            "evento": "record",
            "rotulo": "Registrar decisão",
            "estado": "oab_decision_pending",
            "detalhe": "Os tipos e critérios da decisão ainda precisam ser fechados.",
            "contextoJornada": "administrador"
          },
          {
            "id": "oab_detail_back_termino",
            "tipo": "estado_final",
            "evento": "back",
            "rotulo": "Voltar à fila",
            "estado": "oab_back_state",
            "detalhe": "Retorna sem decisão.",
            "contextoJornada": "administrador"
          }
        ]
      }
    ]
  },
  "dados": {
    "grupos": {},
    "fontes": [],
    "persistencia": {
      "entidades": [],
      "relacoes": []
    }
  },
  "mocks": {
    "grupos": {},
    "cenarios": {
      "padrao": {
        "id": "padrao"
      },
      "administrador_oab_decision_pending": {
        "id": "administrador_oab_decision_pending"
      },
      "administrador_oab_back_state": {
        "id": "administrador_oab_back_state"
      }
    }
  },
  "flow": {
    "editor": {
      "entrypoint": false,
      "rootSequenceId": null,
      "occurrences": [
        {
          "id": "screen-modelo-administrador-oab_detail",
          "sequenceId": "sequence-modelo-administrador",
          "order": 5,
          "variant": "padrao"
        }
      ],
      "branches": []
    }
  }
}
