{
  "schema": "advogadoja.tela.modular.v4-proposta",
  "identidade": {
    "id": "advogado.dados_oab",
    "nome": "Dados da OAB",
    "tipo": "tela",
    "versao": "3.0.0",
    "rota": "/onboarding/advogado/oab",
    "status": "rascunho-evolutivo"
  },
  "classificacao": {
    "escopo": "advogado",
    "jornadas": [
      "advogado"
    ],
    "subjornadas": [
      "onboarding"
    ],
    "compartilhada": false,
    "localizacaoArvore": {
      "secao": "Telas",
      "segmentos": [
        "advogado"
      ],
      "chave": "dados_oab",
      "ordem": 67
    }
  },
  "estados": {
    "fonte": "contexto.estado",
    "fallbackSeguro": "padrao",
    "grupos": [
      {
        "id": "padrao",
        "nome": "Padrão"
      },
      {
        "id": "advogado_oab_submitted",
        "nome": "Validação da OAB em processamento",
        "jornada": "advogado",
        "origemNo": "oab_submitted"
      },
      {
        "id": "advogado_same_home_return",
        "nome": "Retorno à mesma Home Profissional",
        "jornada": "advogado",
        "origemNo": "same_home_return"
      }
    ]
  },
  "componentes": {
    "instancias": [
      {
        "id": "estilos_base_advogado",
        "ref": "style.jornadas.modular.advogado.v01",
        "slot": "styles",
        "ordem": 0,
        "props": {},
        "aplicaA": {
          "jornadas": [
            "advogado"
          ],
          "estados": [
            "*"
          ]
        }
      },
      {
        "id": "conteudo_advogado",
        "ref": "cmp.advogado.dados_oab.perfil_advogado.v01",
        "slot": "main",
        "ordem": 10,
        "props": {},
        "aplicaA": {
          "jornadas": [
            "advogado"
          ],
          "estados": [
            "*"
          ]
        }
      }
    ]
  },
  "estrutura": {
    "base": {
      "id": "html_base_advogado_dados_oab",
      "html": "<div class=\"prototype-screen\" data-screen-id=\"advogado.dados_oab\"><div data-slot=\"styles\"></div><main data-slot=\"main\"></main></div>",
      "raiz": "prototype-screen",
      "layout": {
        "larguraConteudo": "100%",
        "slots": [
          "styles",
          "main"
        ],
        "resolucao": "cada grupo de estrutura insere instâncias no slot data-slot correspondente"
      },
      "aplicaA": {
        "jornadas": [
          "administrador",
          "advogado",
          "estudante"
        ],
        "estados": [
          "*"
        ]
      }
    },
    "grupos": [
      {
        "id": "estilos_advogado",
        "slot": "styles",
        "ordem": 0,
        "instancias": [
          "estilos_base_advogado"
        ],
        "aplicaA": {
          "jornadas": [
            "advogado"
          ],
          "estados": [
            "*"
          ]
        }
      },
      {
        "id": "conteudo_advogado",
        "slot": "main",
        "ordem": 10,
        "instancias": [
          "conteudo_advogado"
        ],
        "aplicaA": {
          "jornadas": [
            "advogado"
          ],
          "estados": [
            "*"
          ]
        }
      }
    ]
  },
  "estilos": {
    "tema": {},
    "grupos": []
  },
  "acoes": {
    "grupos": [
      {
        "id": "navegacao_advogado_oab_data",
        "origem": "jornada_modelo",
        "aplicaA": {
          "jornadas": [
            "advogado"
          ],
          "estados": [
            "*"
          ]
        },
        "acoes": [
          {
            "id": "oab_data_continua_termino",
            "tipo": "estado_final",
            "evento": "continua",
            "rotulo": "Continuar",
            "estado": "oab_submitted",
            "detalhe": "",
            "contextoJornada": "advogado"
          }
        ]
      }
    ]
  },
  "dados": {
    "grupos": {},
    "fontes": [],
    "persistencia": {
      "entidades": [
        {
          "id": "lawyer_oab_records",
          "nome": "Registro OAB",
          "dominio": "lawyer",
          "campos": [
            {
              "id": "id",
              "tipo": "uuid · PK",
              "acesso": "a_confirmar"
            },
            {
              "id": "lawyer_profile_id",
              "tipo": "uuid · FK · UNIQUE",
              "acesso": "a_confirmar"
            },
            {
              "id": "oab_number",
              "tipo": "varchar",
              "acesso": "a_confirmar"
            },
            {
              "id": "oab_state",
              "tipo": "char(2)",
              "acesso": "a_confirmar"
            },
            {
              "id": "status",
              "tipo": "varchar",
              "acesso": "a_confirmar"
            },
            {
              "id": "submitted_at",
              "tipo": "timestamptz?",
              "acesso": "a_confirmar"
            },
            {
              "id": "validated_at",
              "tipo": "timestamptz?",
              "acesso": "a_confirmar"
            },
            {
              "id": "last_checked_at",
              "tipo": "timestamptz?",
              "acesso": "a_confirmar"
            }
          ]
        },
        {
          "id": "oab_status_history",
          "nome": "Histórico da OAB",
          "dominio": "lawyer",
          "campos": [
            {
              "id": "id",
              "tipo": "uuid · PK",
              "acesso": "a_confirmar"
            },
            {
              "id": "oab_record_id",
              "tipo": "uuid · FK",
              "acesso": "a_confirmar"
            },
            {
              "id": "from_status",
              "tipo": "varchar?",
              "acesso": "a_confirmar"
            },
            {
              "id": "to_status",
              "tipo": "varchar",
              "acesso": "a_confirmar"
            },
            {
              "id": "reason",
              "tipo": "text?",
              "acesso": "a_confirmar"
            },
            {
              "id": "actor_user_id",
              "tipo": "uuid · FK?",
              "acesso": "a_confirmar"
            },
            {
              "id": "created_at",
              "tipo": "timestamptz",
              "acesso": "a_confirmar"
            }
          ]
        }
      ],
      "relacoes": [
        {
          "id": "rel-lawyer_profiles-lawyer_profile_id-lawyer_oab_records",
          "origem": {
            "entidade": "lawyer_profiles"
          },
          "destino": {
            "entidade": "lawyer_oab_records"
          },
          "campoReferencia": "lawyer_profile_id",
          "cardinalidade": "1:1"
        },
        {
          "id": "rel-lawyer_oab_records-oab_record_id-oab_status_history",
          "origem": {
            "entidade": "lawyer_oab_records"
          },
          "destino": {
            "entidade": "oab_status_history"
          },
          "campoReferencia": "oab_record_id",
          "cardinalidade": "1:N"
        }
      ],
      "contrato": "declarações canônicas da tela; Banco é projeção agregada destas declarações"
    }
  },
  "mocks": {
    "grupos": {},
    "cenarios": {
      "padrao": {
        "id": "padrao"
      },
      "advogado_oab_submitted": {
        "id": "advogado_oab_submitted"
      },
      "advogado_same_home_return": {
        "id": "advogado_same_home_return"
      }
    }
  },
  "flow": {
    "editor": {
      "entrypoint": false,
      "rootSequenceId": null,
      "occurrences": [
        {
          "id": "screen-modelo-advogado-oab_data",
          "sequenceId": "sequence-modelo-advogado",
          "order": 45,
          "variant": "padrao"
        }
      ],
      "branches": []
    }
  }
}
