{
  "schema": "advogadoja.tela.modular.v4-proposta",
  "identidade": {
    "id": "cliente.onboarding.preferencias_contato",
    "nome": "Preferências de contato",
    "tipo": "tela",
    "versao": "3.0.0",
    "rota": "/onboarding/cliente/preferencias-contato",
    "status": "rascunho-evolutivo"
  },
  "classificacao": {
    "escopo": "cliente",
    "jornadas": [
      "cliente"
    ],
    "subjornadas": [
      "onboarding"
    ],
    "compartilhada": false,
    "localizacaoArvore": {
      "secao": "Telas",
      "segmentos": [
        "cliente",
        "onboarding"
      ],
      "chave": "preferencias_contato",
      "ordem": 11
    }
  },
  "estados": {
    "fonte": "contexto.estado",
    "fallbackSeguro": "padrao",
    "grupos": [
      {
        "id": "padrao",
        "nome": "Padrão"
      }
    ]
  },
  "componentes": {
    "instancias": [
      {
        "id": "estilos_base_cliente",
        "ref": "style.jornadas.modular.cliente.v01",
        "slot": "styles",
        "ordem": 0,
        "props": {},
        "aplicaA": {
          "jornadas": [
            "cliente"
          ],
          "estados": [
            "*"
          ]
        }
      },
      {
        "id": "conteudo_cliente",
        "ref": "cmp.cliente.onboarding.preferencias_contato.perfil_cliente.v01",
        "slot": "main",
        "ordem": 10,
        "props": {},
        "aplicaA": {
          "jornadas": [
            "cliente"
          ],
          "estados": [
            "*"
          ]
        }
      }
    ]
  },
  "estrutura": {
    "base": {
      "id": "html_base_cliente_onboarding_preferencias_contato",
      "html": "<div class=\"prototype-screen\" data-screen-id=\"cliente.onboarding.preferencias_contato\"><div data-slot=\"styles\"></div><main data-slot=\"main\"></main></div>",
      "raiz": "prototype-screen",
      "layout": {
        "larguraConteudo": "100%",
        "slots": [
          "styles",
          "main"
        ],
        "resolucao": "cada grupo de estrutura insere instâncias no slot data-slot correspondente"
      },
      "aplicaA": {
        "jornadas": [
          "administrador",
          "advogado",
          "cliente",
          "estudante"
        ],
        "estados": [
          "*"
        ]
      }
    },
    "grupos": [
      {
        "id": "estilos_cliente",
        "slot": "styles",
        "ordem": 0,
        "instancias": [
          "estilos_base_cliente"
        ],
        "aplicaA": {
          "jornadas": [
            "cliente"
          ],
          "estados": [
            "*"
          ]
        }
      },
      {
        "id": "conteudo_cliente",
        "slot": "main",
        "ordem": 10,
        "instancias": [
          "conteudo_cliente"
        ],
        "aplicaA": {
          "jornadas": [
            "cliente"
          ],
          "estados": [
            "*"
          ]
        }
      }
    ]
  },
  "estilos": {
    "tema": {},
    "grupos": []
  },
  "acoes": {
    "grupos": [
      {
        "id": "navegacao_cliente_on_pref",
        "origem": "jornada_modelo",
        "aplicaA": {
          "jornadas": [
            "cliente"
          ],
          "estados": [
            "*"
          ]
        },
        "acoes": [
          {
            "id": "on_pref_continua_cliente.onboarding.concluido",
            "tipo": "navegacao_declarada",
            "evento": "continua",
            "rotulo": "Continuar",
            "destino": "cliente.onboarding.concluido",
            "contextoJornada": "cliente",
            "origemNo": "on_pref",
            "caminho": "continua",
            "estadosIntermediarios": [],
            "detalhe": ""
          }
        ]
      }
    ]
  },
  "dados": {
    "grupos": {},
    "fontes": [],
    "persistencia": {
      "entidades": [
        {
          "id": "user_contact_preferences",
          "nome": "Preferências de contato",
          "dominio": "core",
          "campos": [
            {
              "id": "id",
              "tipo": "uuid · PK",
              "acesso": "a_confirmar"
            },
            {
              "id": "user_profile_id",
              "tipo": "uuid · FK",
              "acesso": "a_confirmar"
            },
            {
              "id": "allow_email",
              "tipo": "boolean",
              "acesso": "a_confirmar"
            },
            {
              "id": "allow_phone",
              "tipo": "boolean",
              "acesso": "a_confirmar"
            },
            {
              "id": "allow_whatsapp",
              "tipo": "boolean",
              "acesso": "a_confirmar"
            },
            {
              "id": "allow_push",
              "tipo": "boolean",
              "acesso": "a_confirmar"
            },
            {
              "id": "updated_at",
              "tipo": "timestamptz",
              "acesso": "a_confirmar"
            }
          ]
        }
      ],
      "relacoes": [
        {
          "id": "rel-user_profiles-user_profile_id-user_contact_preferences",
          "origem": {
            "entidade": "user_profiles"
          },
          "destino": {
            "entidade": "user_contact_preferences"
          },
          "campoReferencia": "user_profile_id",
          "cardinalidade": "1:1/N"
        }
      ],
      "contrato": "declarações canônicas da tela; Banco é projeção agregada destas declarações"
    }
  },
  "mocks": {
    "grupos": {},
    "cenarios": {
      "padrao": {
        "id": "padrao"
      }
    }
  },
  "flow": {
    "editor": {
      "entrypoint": false,
      "rootSequenceId": null,
      "occurrences": [
        {
          "id": "screen-modelo-cliente-on_pref",
          "sequenceId": "sequence-modelo-cliente",
          "order": 7,
          "variant": "padrao"
        }
      ],
      "branches": []
    }
  }
}
